{
  "$schema": "http://json-schema.org/draft-07/schema#",
  "title": "PokemonData",
  "description": "Schema for representing Pokemon data, including its types, tier rankings, and weaknesses.",
  "type": "object",
  "properties": {
    "id": {
      "type": "integer",
      "description": "The unique Pokedex identifier for the Pokemon."
    },
    "name": {
      "type": "string",
      "description": "The name of the Pokemon (e.g., squirtle)."
    },
    "types": {
      "type": "array",
      "description": "A list of the Pokemon's elemental types.",
      "items": {
        "type": "object",
        "properties": {
          "type": {
            "type": "object",
            "properties": {
              "name": {
                "type": "string",
                "description": "The name of the elemental type (e.g., water, fire)."
              }
            },
            "required": ["name"]
          }
        },
        "required": ["type"]
      }
    },
    "shiny": {
      "type": "boolean",
      "description": "Indicates if the shiny variant is being described or is available."
    },
    "tier_ranking": {
      "type": "array",
      "description": "A list of tier rankings for different categories (e.g., raid attacker, gym defender, specific type matchups).",
      "items": {
        "type": "object",
        "properties": {
          "name": {
            "type": "string",
            "description": "The category or item being ranked (e.g., 'raid attacker', 'grass type')."
          },
          "tier": {
            "type": "string",
            "description": "The assigned tier (e.g., S, A, F). You could also use an enum here if you have a fixed set of tiers: \"enum\": [\"S\", \"A\", \"B\", \"C\", \"D\", \"F\"]"
          }
        },
        "required": ["name", "tier"]
      }
    },
    "weakness": {
      "type": "array",
      "description": "A list of elemental types the Pokemon is weak against.",
      "items": {
        "type": "object",
        "properties": {
          "type": {
            "type": "object",
            "properties": {
              "name": {
                "type": "string",
                "description": "The name of the weakness type (e.g., electric, grass)."
              },
              "amount": {
                "type": "string",
                "description": "The damage multiplier for the weakness (e.g., '60%', '2x', '160%'). Consider if a number type would be more appropriate if you're doing calculations (e.g., 1.6 for 160%).",
                "pattern": "^(\\d{1,3}%|\\d*\\.?\\d+x)$"
              }
            },
            "required": ["name", "amount"]
          }
        },
        "required": ["type"]
      }
    }
  },
  "required": [
    "id",
    "name",
    "types",
    "shiny",
    "tier_ranking",
    "weakness"
  ]
}